{
  "format": "reveal-sheet",
  "schemaVersion": 1,
  "appVersion": "0.9.0",
  "kind": "editable",
  "document": {
    "id": "document_v0_0_9_0",
    "revision": 1,
    "title": "v0.9.0 fixture",
    "defaults": {
      "mode": "guided",
      "otherAnswers": "visible",
      "coverColor": "#16624f"
    },
    "pages": [
      {
        "id": "page_v0_0_9_0",
        "title": "Page 1",
        "description": "",
        "imageId": "image_v0_0_9_0",
        "questionOrder": [
          "question_v0_0_9_0"
        ]
      }
    ],
    "assets": [
      {
        "id": "image_v0_0_9_0",
        "mime": "image/png",
        "width": 1,
        "height": 1,
        "byteLength": 68,
        "dataBase64": "iVBORw0KGgoAAAANSUhEUgAAAAEAAAABCAYAAAAfFcSJAAAAC0lEQVR4nGP4DwQACfsD/fteaysAAAAASUVORK5CYII="
      }
    ],
    "questions": [
      {
        "id": "question_v0_0_9_0",
        "pageId": "page_v0_0_9_0",
        "revision": 1,
        "maskIds": [
          "mask_v0_0_9_0"
        ],
        "prompt": "Prompt",
        "answer": "Answer"
      }
    ],
    "masks": [
      {
        "id": "mask_v0_0_9_0",
        "pageId": "page_v0_0_9_0",
        "kind": "answer",
        "questionId": "question_v0_0_9_0",
        "rect": {
          "x": 0,
          "y": 0,
          "w": 1,
          "h": 1
        }
      }
    ]
  }
}
