{
  "format": "reveal-sheet",
  "schemaVersion": 1,
  "appVersion": "0.2.0",
  "kind": "editable",
  "document": {
    "id": "document_fixture",
    "revision": 1,
    "title": "v0.2.0 fixture",
    "defaults": {
      "mode": "free",
      "otherAnswers": "hidden"
    },
    "pages": [
      {
        "id": "page_fixture",
        "title": "Page 1",
        "description": "",
        "imageId": "image_fixture",
        "questionOrder": []
      }
    ],
    "assets": [
      {
        "id": "image_fixture",
        "mime": "image/png",
        "width": 1,
        "height": 1,
        "byteLength": 68,
        "dataBase64": "iVBORw0KGgoAAAANSUhEUgAAAAEAAAABCAYAAAAfFcSJAAAAC0lEQVR4nGP4DwQACfsD/fteaysAAAAASUVORK5CYII="
      }
    ],
    "questions": [],
    "masks": []
  }
}
